{
  "schema_version": 1,
  "round": 12,
  "merged_result": "not_pass",
  "action": "fix_and_rerun_review",
  "issues": [
    {
      "id": "CHK-SCOPE",
      "channel": "goal",
      "severity": "blocker",
      "file": "",
      "line_range": "",
      "summary": "verify-review scope failed",
      "suggestion": "",
      "root_cause": "implement_error"
    }
  ],
  "resolved_since_last_round": [],
  "next_steps": [
    "read evidence/review-fix-input.json",
    "fix within write_set",
    "gate --post implement if diff changed",
    "assemble-review-packet.sh",
    "run-independent-review.sh",
    "merge-review-issues.sh",
    "gate --post review"
  ],
  "provenance": {
    "review_run_id": "f7977dfa36cc1f19",
    "packet_hash": "d667df7afee655b7",
    "gf_skill_attested": true,
    "channels": [
      "goal",
      "guazi-flow-review"
    ]
  }
}